Ether / IPv6 / TCP 2600:1700:f370:90d0:997f:59ea:eab0:b77e:54354 > 2607:f8b0:4023:1004::5e:https PA / Raw
Ether / IPv6 / TCP 2600:1700:f370:90d0:997f:59ea:eab0:b77e:54354 > 2607:f8b0:4023:1004::5e:https PA / Raw
Ether / IPv6 / TCP 2607:f8b0:4023:1004::5e:https > 2600:1700:f370:90d0:997f:59ea:eab0:b77e:54354 A
Ether / IPv6 / TCP 2607:f8b0:4023:1004::5e:https > 2600:1700:f370:90d0:997f:59ea:eab0:b77e:54354 A
Ether / IPv6 / TCP 2607:f8b0:4023:1004::5e:https > 2600:1700:f370:90d0:997f:59ea:eab0:b77e:54354 PA / Raw
Ether / IP / TCP 35.201.127.49:https > 192.168.1.128:63102 PA / Raw
Ether / IP / TCP 192.168.1.128:63102 > 35.201.127.49:https PA / Raw
Ether / IP / TCP 35.201.127.49:https > 192.168.1.128:63102 A / Padding
Ether / IP / TCP 192.168.1.128:63385 > 108.156.83.72:https A
Ether / IP / TCP 35.201.127.49:https > 192.168.1.128:63075 PA / Raw
Ether / IP / TCP 192.168.1.240:55926 > 104.18.40.204:https PA / Raw
Ether / IP / TCP 104.18.40.204:https > 192.168.1.240:55926 A / Padding
Ether / IP / UDP / DNS Qry "b'quillbot.com.'" 
Ether / IP / TCP 192.168.1.240:58016 > 104.18.36.252:https PA / Raw
Ether / IP / TCP 192.168.1.240:58016 > 104.18.36.252:https PA / Raw
Ether / IP / TCP 192.168.1.240:58016 > 104.18.36.252:https PA / Raw
Ether / IP / TCP 104.18.36.252:https > 192.168.1.240:58016 A / Padding
Ether / IP / TCP 104.18.36.252:https > 192.168.1.240:58016 PA / Raw
Ether / IP / UDP / DNS Ans "172.64.151.4" 
Ether / IP / TCP 104.18.36.252:https > 192.168.1.240:58016 A / Padding
Ether / IP / TCP 104.18.36.252:https > 192.168.1.240:58016 A / Padding
Ether / IP / TCP 192.168.1.240:58016 > 104.18.36.252:https A
Ether / IP / UDP 192.168.1.180:59398 > 255.255.255.255:6667 / Raw
Ether / IP / TCP 104.18.36.252:https > 192.168.1.240:58016 A / Padding
Ether / IP / TCP 35.201.127.49:https > 192.168.1.240:58462 PA / Raw
Ether / IP / TCP 104.18.36.252:https > 192.168.1.240:58016 PA / Raw
Ether / IP / TCP 104.18.36.252:https > 192.168.1.240:58016 PA / Raw
Ether / IP / TCP 104.18.36.252:https > 192.168.1.240:58016 PA / Raw
Ether / IP / TCP 192.168.1.240:58016 > 104.18.36.252:https A
Ether / IP / TCP 192.168.1.240:58462 > 35.201.127.49:https PA / Raw
Ether / IP / TCP 192.168.1.240:58016 > 104.18.36.252:https PA / Raw
Ether / IP / TCP 35.201.127.49:https > 192.168.1.240:58462 A / Padding
Ether / IP / TCP 104.18.36.252:https > 192.168.1.240:58016 A / Padding
Ether / IP / TCP 192.168.1.240:58016 > 104.18.36.252:https PA / Raw
Ether / IP / TCP 192.168.1.240:58016 > 104.18.36.252:https PA / Raw
Ether / IP / TCP 104.18.36.252:https > 192.168.1.240:58016 A / Padding
Ether / IP / TCP 104.18.36.252:https > 192.168.1.240:58016 A / Padding
Ether / IP / TCP 104.18.36.252:https > 192.168.1.240:58016 A / Padding
Ether / IP / TCP 104.18.36.252:https > 192.168.1.240:58016 A / Padding
Ether / IP / TCP 104.18.36.252:https > 192.168.1.240:58016 A / Padding
Ether / IP / TCP 192.168.1.240:53724 > 149.154.174.100:https PA / Raw
Ether / IP / TCP 149.154.174.100:https > 192.168.1.240:53724 A / Padding
Ether / IP / TCP 149.154.174.100:https > 192.168.1.240:53724 PA / Raw
Ether / IP / TCP 192.168.1.240:53724 > 149.154.174.100:https A
Ether / IP / TCP 54.87.168.100:https > 192.168.1.240:58685 PA / Raw
Ether / IP / TCP 54.87.168.100:https > 192.168.1.240:58685 PA / Raw
Ether / IP / TCP 54.87.168.100:https > 192.168.1.240:58685 PA / Raw
Ether / IP / TCP 192.168.1.240:58685 > 54.87.168.100:https A
Ether / IP / TCP 192.168.1.240:58623 > 65.8.178.50:https A / Raw
Ether / IP / TCP 65.8.178.50:https > 192.168.1.240:58623 A
Ether / IP / UDP / DNS Qry "b'analytics-toolbar.urban-vpn.com.'" 
Ether / IP / UDP / DNS Qry "b'analytics-toolbar.urban-vpn.com.'" 
Ether / IP / UDP / DNS Ans "148.72.164.12" 
Ether / IP / TCP 192.168.1.240:58689 > 148.72.164.12:40443 S
Ether / IP / UDP / DNS Qry "b'api.amplitude.com.'" 
d0:fc:d0:3c:dd:c8 > ff:ff:ff:ff:ff:ff (0x7373) / Raw
Ether / IP / UDP 192.168.1.128:54729 > 192.168.1.255:59870 / Raw
Ether / IP / UDP 192.168.1.128:54730 > 192.168.1.255:59870 / Raw
Ether / IP / UDP 192.168.1.128:54734 > 192.168.1.255:59870 / Raw
Ether / IP / UDP 192.168.1.128:54737 > 192.168.1.255:59870 / Raw
Ether / IP / UDP / DNS Ans "35.166.153.132" 
Ether / IP / TCP 192.168.1.240:58877 > 35.166.153.132:https S
Ether / IP / TCP 192.168.1.240:58874 > 172.64.151.4:https PA / Raw
Ether / IP / TCP 192.168.1.240:58874 > 172.64.151.4:https PA / Raw
Ether / IP / TCP 172.64.151.4:https > 192.168.1.240:58874 A / Padding
Ether / IP / TCP 172.64.151.4:https > 192.168.1.240:58874 A / Padding
Ether / IP / TCP 172.64.151.4:https > 192.168.1.240:58874 A / Padding
Ether / IP / TCP 172.64.151.4:https > 192.168.1.240:58874 A / Padding
Ether / IP / TCP 172.64.151.4:https > 192.168.1.240:58874 A / Padding
Ether / IP / UDP 142.250.64.202:https > 192.168.1.240:52722 / Raw
Ether / IP / UDP 142.250.64.202:https > 192.168.1.240:52722 / Raw
Ether / IP / UDP 192.168.1.240:52722 > 142.250.64.202:https / Raw
Ether / IP / UDP 192.168.1.240:65505 > 142.250.217.170:https / Raw
Ether / IP / UDP 142.250.217.170:https > 192.168.1.240:65505 / Raw
Ether / IP / UDP 142.250.217.170:https > 192.168.1.240:65505 / Raw
Ether / IP / UDP 142.250.217.170:https > 192.168.1.240:65505 / Raw
Ether / IP / UDP 192.168.1.240:65505 > 142.250.217.170:https / Raw
Ether / IP / UDP 192.168.1.240:52722 > 142.250.64.202:https / Raw
Ether / IP / TCP 35.166.153.132:https > 192.168.1.240:58877 SA
Ether / IP / TCP 192.168.1.240:58877 > 35.166.153.132:https A
Ether / IP / TCP 192.168.1.240:58877 > 35.166.153.132:https PA / Raw
Ether / IP / UDP 142.250.64.202:https > 192.168.1.240:52722 / Raw
Ether / IP / UDP 192.168.1.240:52722 > 142.250.64.202:https / Raw
Ether / IP / UDP 142.250.64.202:https > 192.168.1.240:52722 / Raw
Ether / IP / UDP 192.168.1.240:52722 > 142.250.64.202:https / Raw
Ether / IP / UDP 192.168.1.240:65505 > 142.250.217.170:https / Raw
Ether / IP / UDP 142.250.217.170:https > 192.168.1.240:65505 / Raw
Ether / IP / UDP 142.250.64.202:https > 192.168.1.240:52722 / Raw
Ether / IP / TCP 35.166.153.132:https > 192.168.1.240:58877 A
Ether / IP / TCP 35.166.153.132:https > 192.168.1.240:58877 A / Raw
Ether / IP / TCP 35.166.153.132:https > 192.168.1.240:58877 PA / Raw
Ether / IP / TCP 192.168.1.240:58877 > 35.166.153.132:https A
Ether / IP / TCP 192.168.1.240:58877 > 35.166.153.132:https PA / Raw
Ether / IP / TCP 172.64.151.4:https > 192.168.1.240:58874 PA / Raw
Ether / IP / TCP 172.64.151.4:https > 192.168.1.240:58874 PA / Raw
Ether / IP / TCP 172.64.151.4:https > 192.168.1.240:58874 PA / Raw
Ether / IP / TCP 192.168.1.240:58874 > 172.64.151.4:https A
Ether / IP / TCP 54.204.238.15:https > 192.168.1.240:58051 PA / Raw
Ether / IP / TCP 35.166.153.132:https > 192.168.1.240:58877 A
Ether / IP / TCP 192.168.1.240:58874 > 172.64.151.4:https PA / Raw
Ether / IP / TCP 35.166.153.132:https > 192.168.1.240:58877 PA / Raw
Ether / IP / TCP 35.166.153.132:https > 192.168.1.240:58877 PA / Raw
Ether / IP / TCP 192.168.1.240:58877 > 35.166.153.132:https A
Ether / IP / TCP 172.64.151.4:https > 192.168.1.240:58874 A / Padding
Ether / IP / TCP 192.168.1.240:58877 > 35.166.153.132:https PA / Raw
Ether / IP / TCP 192.168.1.240:58877 > 35.166.153.132:https PA / Raw
Ether / IP / TCP 192.168.1.240:58877 > 35.166.153.132:https PA / Raw
Ether / IP / TCP 54.221.251.148:https > 192.168.1.240:57812 PA / Raw
Ether / IP / TCP 192.168.1.240:58051 > 54.204.238.15:https A
Ether / IP / TCP 192.168.1.240:57812 > 54.221.251.148:https A
Ether / IP / TCP 192.168.1.240:53724 > 149.154.174.100:https PA / Raw
Ether / IP / TCP 192.168.1.240:53720 > 192.168.1.139:8009 PA / Raw
Ether / IP / TCP 192.168.1.139:8009 > 192.168.1.240:53720 A
Ether / IP / TCP 192.168.1.139:8009 > 192.168.1.240:53720 PA / Raw
Ether / IP / TCP 149.154.174.100:https > 192.168.1.240:53724 PA / Raw
Ether / IP / TCP 192.168.1.240:53720 > 192.168.1.139:8009 A
Ether / IP / TCP 192.168.1.240:53724 > 149.154.174.100:https A
Ether / IP / TCP 38.110.1.171:https > 192.168.1.240:54109 PA / Raw
Ether / IP / TCP 172.64.151.4:https > 192.168.1.240:58874 PA / Raw
Ether / IP / TCP 172.64.151.4:https > 192.168.1.240:58874 PA / Raw
Ether / IP / TCP 172.64.151.4:https > 192.168.1.240:58874 PA / Raw
Ether / IP / TCP 192.168.1.240:58874 > 172.64.151.4:https A
Ether / IP / TCP 192.168.1.240:58874 > 172.64.151.4:https PA / Raw
Ether / IP / TCP 172.64.151.4:https > 192.168.1.240:58874 A / Padding
Ether / IP / TCP 192.168.1.240:58874 > 172.64.151.4:https PA / Raw
Ether / IP / TCP 192.168.1.240:58874 > 172.64.151.4:https PA / Raw
Ether / IP / TCP 172.64.151.4:https > 192.168.1.240:58874 A / Padding
Ether / IP / TCP 172.64.151.4:https > 192.168.1.240:58874 A / Padding
Ether / IP / TCP 172.64.151.4:https > 192.168.1.240:58874 A / Padding
Ether / IP / TCP 172.64.151.4:https > 192.168.1.240:58874 A / Padding
Ether / IP / TCP 172.64.151.4:https > 192.168.1.240:58874 A / Padding
Ether / IP / TCP 192.168.1.240:53724 > 149.154.174.100:https PA / Raw
Ether / IP / UDP / DNS Qry "b'api.amplitude.com.'" 
Ether / IP / TCP 192.168.1.240:53719 > 192.168.1.131:8009 PA / Raw
d0:fc:d0:3c:dd:c8 > ff:ff:ff:ff:ff:ff (0x7373) / Raw
Ether / ARP who has 192.168.1.138 says 192.168.1.254 / Padding
Ether / ARP who has 192.168.1.250 says 192.168.1.254 / Padding
Ether / ARP who has 192.168.1.131 says 192.168.1.254 / Padding
Ether / ARP who has 192.168.1.186 says 192.168.1.254 / Padding
Ether / ARP who has 192.168.1.198 says 192.168.1.254 / Padding
Ether / ARP who has 192.168.1.212 says 192.168.1.254 / Padding
Ether / ARP who has 192.168.1.193 says 192.168.1.254 / Padding
Ether / ARP who has 192.168.1.195 says 192.168.1.254 / Padding
Ether / ARP who has 192.168.1.200 says 192.168.1.254 / Padding
Ether / ARP who has 192.168.1.217 says 192.168.1.254 / Padding
Ether / ARP who has 192.168.1.139 says 192.168.1.254 / Padding
Ether / ARP who has 192.168.1.180 says 192.168.1.254 / Padding
Ether / ARP who has 192.168.1.205 says 192.168.1.254 / Padding
Ether / ARP who has 192.168.1.199 says 192.168.1.254 / Padding
Ether / ARP who has 192.168.1.179 says 192.168.1.254 / Padding
Ether / ARP who has 192.168.1.145 says 192.168.1.254 / Padding
Ether / ARP who has 192.168.1.68 says 192.168.1.254 / Padding
Ether / ARP who has 192.168.1.209 says 192.168.1.254 / Padding
Ether / ARP who has 192.168.1.149 says 192.168.1.254 / Padding
Ether / ARP who has 192.168.1.185 says 192.168.1.254 / Padding
Ether / ARP who has 192.168.1.240 says 192.168.1.254 / Padding
Ether / ARP who has 192.168.1.128 says 192.168.1.254 / Padding
Ether / IP / TCP 149.154.174.100:https > 192.168.1.240:53724 PA / Raw
Ether / ARP is at f4:a4:75:aa:45:ab says 192.168.1.240
Ether / IP / UDP / DNS Ans "54.191.105.55" 
Ether / IP / TCP 104.18.36.252:https > 192.168.1.240:59240 PA / Raw
Ether / IP / TCP 104.18.36.252:https > 192.168.1.240:59240 PA / Raw
Ether / IP / TCP 104.18.36.252:https > 192.168.1.240:59240 PA / Raw
Ether / IP / TCP 192.168.1.240:59240 > 104.18.36.252:https A
Ether / IP / TCP 192.168.1.240:59240 > 104.18.36.252:https PA / Raw
Ether / IP / TCP 104.18.36.252:https > 192.168.1.240:59240 A / Padding
d0:fc:d0:3c:dd:c8 > ff:ff:ff:ff:ff:ff (0x7373) / Raw
Ether / IP / UDP / DNS Qry "b'_rdlink._tcp.local.'" 
Ether / IP / TCP 192.168.1.240:59161 > 142.250.138.101:https A / Raw
Ether / IP / TCP 192.168.1.240:58824 > 142.250.217.206:https A / Raw
Ether / IP / TCP 192.168.1.240:55408 > 192.168.1.139:8009 PA / Raw
Ether / IP / TCP 192.168.1.139:8009 > 192.168.1.240:55408 A
Ether / IP / TCP 192.168.1.139:8009 > 192.168.1.240:55408 PA / Raw
Ether / IP / TCP 142.250.217.206:https > 192.168.1.240:58824 A
Ether / IP / TCP 142.250.138.101:https > 192.168.1.240:59161 A
Ether / IP / TCP 192.168.1.240:55408 > 192.168.1.139:8009 A
Ether / IP / TCP 192.168.1.240:59219 > 142.250.217.195:https A / Raw
Ether / IP / TCP 142.250.217.195:https > 192.168.1.240:59219 A
Ether / IP / TCP 192.168.1.240:59218 > 142.250.217.205:https A / Raw
Ether / IP / TCP 142.250.217.205:https > 192.168.1.240:59218 A
Ether / IP / TCP 192.168.1.240:53723 > 31.13.67.52:https PA / Raw
Ether / IP / UDP 192.168.1.240:52711 > 192.168.1.255:59870 / Raw
Ether / IP / TCP 192.168.1.240:54329 > 54.173.38.125:https PA / Raw
Ether / IP / TCP 31.13.67.52:https > 192.168.1.240:53723 PA / Raw
Ether / IP / TCP 54.173.38.125:https > 192.168.1.240:54329 A / Padding
Ether / IP / UDP 192.168.1.128:49937 > 192.168.1.240:59871 / Raw
Ether / IP / UDP 192.168.1.128:49940 > 192.168.1.240:59871 / Raw
Ether / IP / UDP 192.168.1.128:49941 > 192.168.1.240:59871 / Raw
Ether / IP / UDP 192.168.1.128:49945 > 192.168.1.240:59871 / Raw
Ether / IP / TCP 192.168.1.240:53723 > 31.13.67.52:https A
Ether / IP / UDP 192.168.1.128:49935 > 192.168.1.255:59870 / Raw
Ether / IP / UDP 192.168.1.128:49936 > 192.168.1.255:59870 / Raw
Ether / IP / UDP 192.168.1.128:49939 > 192.168.1.255:59870 / Raw
Ether / IP / UDP 192.168.1.128:49942 > 192.168.1.255:59870 / Raw
Ether / IP / TCP 192.168.1.240:59220 > 204.79.197.239:https A / Raw
Ether / IP / TCP 54.173.38.125:https > 192.168.1.240:54329 PA / Raw
Ether / IP / UDP 192.168.1.240:52713 > 192.168.1.128:59871 / Raw
Ether / IP / UDP 192.168.1.240:52714 > 192.168.1.255:59870 / Raw
Ether / IP / UDP 192.168.1.240:52716 > 192.168.1.128:59871 / Raw
Ether / IP / UDP 192.168.1.128:49948 > 192.168.1.240:59871 / Raw
Ether / IP / TCP 204.79.197.239:https > 192.168.1.240:59220 A
Ether / IP / UDP 192.168.1.128:49950 > 192.168.1.240:59871 / Raw
Ether / IP / TCP 192.168.1.240:54329 > 54.173.38.125:https A
Ether / IP / UDP 192.168.1.128:49947 > 192.168.1.255:59870 / Raw
Ether / IP / TCP 192.168.1.240:59061 > 34.66.73.214:https A / Raw
Ether / IP / TCP 34.66.73.214:https > 192.168.1.240:59061 A
Ether / IP / TCP 192.168.1.240:53719 > 192.168.1.131:8009 PA / Raw
Ether / IP / TCP 192.168.1.131:8009 > 192.168.1.240:53719 PA / Raw
Ether / IP / TCP 192.168.1.240:53719 > 192.168.1.131:8009 A
Ether / IP / TCP 192.168.1.240:55408 > 192.168.1.139:8009 PA / Raw
Ether / IP / TCP 192.168.1.139:8009 > 192.168.1.240:55408 A
Ether / IP / TCP 192.168.1.139:8009 > 192.168.1.240:55408 PA / Raw
Ether / IP / TCP 54.209.91.188:https > 192.168.1.240:57502 PA / Raw
Ether / IP / TCP 192.168.1.240:55408 > 192.168.1.139:8009 A
Ether / IP / TCP 192.168.1.240:57502 > 54.209.91.188:https A
d0:fc:d0:3c:dd:c8 > ff:ff:ff:ff:ff:ff (0x7373) / Raw
Ether / IP / UDP 192.168.1.186:59062 > 255.255.255.255:6667 / Raw
d0:fc:d0:3c:dd:c8 > ff:ff:ff:ff:ff:ff (0x7373) / Raw
Ether / ARP who has 192.168.1.138 says 192.168.1.254 / Padding
Ether / ARP who has 192.168.1.250 says 192.168.1.254 / Padding
Ether / ARP who has 192.168.1.131 says 192.168.1.254 / Padding
Ether / ARP who has 192.168.1.186 says 192.168.1.254 / Padding
Ether / ARP who has 192.168.1.198 says 192.168.1.254 / Padding
Ether / ARP who has 192.168.1.212 says 192.168.1.254 / Padding
Ether / ARP who has 192.168.1.193 says 192.168.1.254 / Padding
Ether / ARP who has 192.168.1.195 says 192.168.1.254 / Padding
Ether / ARP who has 192.168.1.200 says 192.168.1.254 / Padding
Ether / ARP who has 192.168.1.217 says 192.168.1.254 / Padding
Ether / ARP who has 192.168.1.139 says 192.168.1.254 / Padding
Ether / ARP who has 192.168.1.180 says 192.168.1.254 / Padding
Ether / ARP who has 192.168.1.205 says 192.168.1.254 / Padding
Ether / ARP who has 192.168.1.199 says 192.168.1.254 / Padding
Ether / ARP who has 192.168.1.179 says 192.168.1.254 / Padding
Ether / ARP who has 192.168.1.145 says 192.168.1.254 / Padding
Ether / ARP who has 192.168.1.68 says 192.168.1.254 / Padding
Ether / ARP who has 192.168.1.209 says 192.168.1.254 / Padding
Ether / ARP who has 192.168.1.149 says 192.168.1.254 / Padding
Ether / ARP who has 192.168.1.185 says 192.168.1.254 / Padding
Ether / ARP who has 192.168.1.240 says 192.168.1.254 / Padding
Ether / ARP who has 192.168.1.128 says 192.168.1.254 / Padding
Ether / IP / UDP 142.250.64.202:https > 192.168.1.240:52722 / Raw
Ether / IP / TCP 54.221.251.148:https > 192.168.1.240:57812 PA / Raw
Ether / IP / UDP 142.250.64.202:https > 192.168.1.240:52722 / Raw
Ether / IP / UDP 142.250.64.202:https > 192.168.1.240:52722 / Raw
Ether / IP / TCP 54.204.238.15:https > 192.168.1.240:58051 PA / Raw
Ether / ARP is at f4:a4:75:aa:45:ab says 192.168.1.240
Ether / IP / UDP 192.168.1.240:52722 > 142.250.64.202:https / Raw
Ether / IP / UDP 192.168.1.240:53138 > 142.250.138.95:https / Raw
Ether / IP / UDP 142.250.138.95:https > 192.168.1.240:53138 / Raw
Ether / IP / TCP 192.168.1.240:57812 > 54.221.251.148:https A
Ether / IP / TCP 192.168.1.240:58051 > 54.204.238.15:https A
Ether / IP / UDP 142.250.138.95:https > 192.168.1.240:53138 / Raw
Ether / IP / UDP 142.250.138.95:https > 192.168.1.240:53138 / Raw
Ether / IP / UDP 192.168.1.240:53138 > 142.250.138.95:https / Raw
Ether / IP / TCP 104.18.36.252:https > 192.168.1.240:59240 A / Padding
Ether / ARP who has 192.168.1.205 says 192.168.1.254 / Padding
Ether / IP / UDP / DNS Qry "b'_printer._tcp.local.'" 
Ether / IP / UDP / DNS Qry "b'_pdl-datastream._tcp.local.'" 
Ether / IP / UDP / DNS Qry "b'_http._tcp.local.'" 
Ether / IP / UDP / DNS Qry "b'_scanner._tcp.local.'" 
Ether / IP / UDP / DNS Qry "b'_ipp._tcp.local.'" 
Ether / IP / UDP / DNS Qry "b'_ipps._tcp.local.'" 
Ether / IP / UDP / DNS Qry "b'_privet._tcp.local.'" 
Ether / IP / UDP / DNS Qry "b'_uscan._tcp.local.'" 
Ether / IP / UDP / DNS Qry "b'_smb._tcp.local.'" 
Ether / ARP who has 192.168.1.199 says 192.168.1.254 / Padding
d0:fc:d0:3c:dd:c8 > ff:ff:ff:ff:ff:ff (0x7373) / Raw
Ether / ARP who has 192.168.1.145 says 192.168.1.254 / Padding
Ether / ARP who has 192.168.1.68 says 192.168.1.254 / Padding
Ether / ARP who has 192.168.1.209 says 192.168.1.254 / Padding
Ether / ARP who has 192.168.1.185 says 192.168.1.254 / Padding
Ether / IP / TCP 192.168.1.240:59240 > 104.18.36.252:https A
Ether / IP / TCP 104.18.36.252:https > 192.168.1.240:59240 PA / Raw
Ether / IP / TCP 104.18.36.252:https > 192.168.1.240:59240 PA / Raw
Ether / IP / TCP 104.18.36.252:https > 192.168.1.240:59240 PA / Raw
Ether / IP / TCP 192.168.1.240:59240 > 104.18.36.252:https A
Ether / IP / TCP 192.168.1.240:59240 > 104.18.36.252:https PA / Raw
Ether / IP / TCP 104.18.36.252:https > 192.168.1.240:59240 A / Padding
Ether / IP / TCP 192.168.1.240:59240 > 104.18.36.252:https PA / Raw
Ether / IP / TCP 192.168.1.240:59240 > 104.18.36.252:https PA / Raw
Ether / IP / TCP 104.18.36.252:https > 192.168.1.240:59240 A / Padding
Ether / IP / TCP 104.18.36.252:https > 192.168.1.240:59240 A / Padding
Ether / IP / TCP 104.18.36.252:https > 192.168.1.240:59240 A / Padding
Ether / IP / TCP 104.18.36.252:https > 192.168.1.240:59240 A / Padding
Ether / IP / TCP 104.18.36.252:https > 192.168.1.240:59240 A / Padding
Ether / IP / UDP 192.168.1.240:55093 > 192.168.1.255:59870 / Raw
Ether / IP / UDP 192.168.1.240:55095 > 192.168.1.128:59871 / Raw
Ether / IP / UDP 192.168.1.240:55096 > 192.168.1.255:59870 / Raw
Ether / IP / UDP 192.168.1.240:55098 > 192.168.1.128:59871 / Raw
Ether / IP / UDP 192.168.1.128:51557 > 192.168.1.240:59871 / Raw
Ether / IP / UDP 192.168.1.128:51559 > 192.168.1.240:59871 / Raw
Ether / IP / TCP 54.221.251.148:https > 192.168.1.240:57812 PA / Raw
Ether / ARP who has 192.168.1.240 says 192.168.1.254 / Padding
Ether / ARP who has 192.168.1.128 says 192.168.1.254 / Padding
Ether / ARP is at f4:a4:75:aa:45:ab says 192.168.1.240
Ether / IP / TCP 54.204.238.15:https > 192.168.1.240:58051 PA / Raw
Ether / IP / TCP 192.168.1.240:57812 > 54.221.251.148:https A
Ether / IP / TCP 192.168.1.240:58051 > 54.204.238.15:https A
Ether / IP / TCP 192.168.1.240:53724 > 149.154.174.100:https PA / Raw
Ether / IP / TCP 149.154.174.100:https > 192.168.1.240:53724 PA / Raw
Ether / IP / TCP 104.18.36.252:https > 192.168.1.240:59240 PA / Raw
Ether / IP / TCP 104.18.36.252:https > 192.168.1.240:59240 PA / Raw
Ether / IP / TCP 104.18.36.252:https > 192.168.1.240:59240 PA / Raw
Ether / IP / TCP 192.168.1.240:59240 > 104.18.36.252:https A
Ether / IP / TCP 192.168.1.240:59240 > 104.18.36.252:https PA / Raw
Ether / IP / TCP 104.18.36.252:https > 192.168.1.240:59240 A / Padding
Ether / IP / TCP 192.168.1.240:53724 > 149.154.174.100:https A
Ether / IP / UDP / DNS Qry "b'api.amplitude.com.'" 
Ether / IP / UDP / DNS Ans "34.223.170.29" 
Ether / IP / TCP 192.168.1.240:59339 > 34.223.170.29:https S
Ether / IP / TCP 34.223.170.29:https > 192.168.1.240:59339 SA
Ether / IP / TCP 192.168.1.240:59339 > 34.223.170.29:https A
Ether / IP / TCP 192.168.1.240:59339 > 34.223.170.29:https PA / Raw
Ether / IP / UDP 192.168.1.128:51561 > 192.168.1.255:59870 / Raw
Ether / IP / UDP 192.168.1.128:51562 > 192.168.1.255:59870 / Raw
Ether / IP / TCP 34.223.170.29:https > 192.168.1.240:59339 A
Ether / IP / TCP 34.223.170.29:https > 192.168.1.240:59339 A / Raw
Ether / IP / TCP 34.223.170.29:https > 192.168.1.240:59339 PA / Raw
Ether / IP / TCP 192.168.1.240:59339 > 34.223.170.29:https A
Ether / IP / TCP 192.168.1.240:59339 > 34.223.170.29:https PA / Raw
Ether / IP / TCP 34.223.170.29:https > 192.168.1.240:59339 A
Ether / IP / TCP 34.223.170.29:https > 192.168.1.240:59339 PA / Raw
Ether / IP / TCP 34.223.170.29:https > 192.168.1.240:59339 PA / Raw
Ether / IP / TCP 192.168.1.240:59339 > 34.223.170.29:https A
Ether / IP / TCP 192.168.1.240:59339 > 34.223.170.29:https PA / Raw
Ether / IP / TCP 192.168.1.240:59339 > 34.223.170.29:https PA / Raw
Ether / IP / TCP 192.168.1.240:59339 > 34.223.170.29:https PA / Raw
Ether / IP / TCP 192.168.1.240:59339 > 34.223.170.29:https PA / Raw
Ether / IP / TCP 192.168.1.240:55799 > 66.110.49.114:https PA / Raw
Ether / IP / TCP 192.168.1.240:55799 > 66.110.49.114:https PA / Raw
Ether / IP / TCP 192.168.1.240:59339 > 34.223.170.29:https PA / Raw
Ether / IP / TCP 192.168.1.240:59339 > 34.223.170.29:https PA / Raw
Ether / IP / TCP 66.110.49.114:https > 192.168.1.240:55799 A / Padding
Ether / IP / TCP 66.110.49.114:https > 192.168.1.240:55799 PA / Raw
Ether / IP / TCP 66.110.49.114:https > 192.168.1.240:55799 PA / Raw
Ether / IP / TCP 66.110.49.114:https > 192.168.1.240:55799 PA / Raw
Ether / IP / TCP 192.168.1.240:55799 > 66.110.49.114:https A
Ether / IP / TCP 34.223.170.29:https > 192.168.1.240:59339 A
Ether / IP / TCP 34.223.170.29:https > 192.168.1.240:59339 PA / Raw
Ether / IP / TCP 34.223.170.29:https > 192.168.1.240:59339 A
Ether / IP / TCP 34.223.170.29:https > 192.168.1.240:59339 PA / Raw
Ether / IP / TCP 34.223.170.29:https > 192.168.1.240:59339 PA / Raw
Ether / IP / TCP 192.168.1.240:59339 > 34.223.170.29:https A
Ether / IP / TCP 192.168.1.240:59339 > 34.223.170.29:https PA / Raw
d0:fc:d0:3c:dd:c8 > ff:ff:ff:ff:ff:ff (0x7373) / Raw
Ether / IP / TCP 34.223.170.29:https > 192.168.1.240:59339 A / Padding
Ether / IP / UDP / DNS Qry "b'_rdlink._tcp.local.'" 
Ether / IP / TCP 192.168.1.240:59271 > 65.8.178.5:https A / Raw
Ether / IP / TCP 65.8.178.5:https > 192.168.1.240:59271 A
Ether / IP / UDP 192.168.1.180:59398 > 255.255.255.255:6667 / Raw
d0:fc:d0:3c:dd:c8 > ff:ff:ff:ff:ff:ff (0x7373) / Raw
Ether / IP / TCP 192.168.1.240:53724 > 149.154.174.100:https PA / Raw
Ether / IP / UDP 192.168.1.128:51564 > 192.168.1.240:59871 / Raw
Ether / IP / UDP 192.168.1.128:51567 > 192.168.1.240:59871 / Raw
Ether / IP / UDP 192.168.1.128:51571 > 192.168.1.240:59871 / Raw
Ether / IP / UDP 192.168.1.128:51573 > 192.168.1.240:59871 / Raw
Ether / IP / TCP 142.250.64.202:https > 192.168.1.240:58210 PA / Raw
Ether / IP / TCP 149.154.174.100:https > 192.168.1.240:53724 PA / Raw
Ether / IP / TCP 192.168.1.240:58210 > 142.250.64.202:https A
Ether / IP / TCP 192.168.1.240:53724 > 149.154.174.100:https A
Ether / IP / UDP 192.168.1.131:9999 > 255.255.255.255:9999 / Raw
Ether / IP / UDP 192.168.1.128:51563 > 192.168.1.255:59870 / Raw
Ether / IP / UDP 192.168.1.128:51565 > 192.168.1.255:59870 / Raw
Ether / IP / UDP 192.168.1.128:51568 > 192.168.1.255:59870 / Raw
Ether / IP / UDP 192.168.1.128:51569 > 192.168.1.255:59870 / Raw
Ether / IP / UDP 192.168.1.186:61734 > 255.255.255.255:6667 / Raw
Ether / IP / TCP 54.70.3.142:https > 192.168.1.240:52774 SA
Ether / IP / TCP 192.168.1.240:52774 > 54.70.3.142:https A
Ether / IP / TCP 192.168.1.240:52774 > 54.70.3.142:https PA / Raw
Ether / IP / TCP 54.70.3.142:https > 192.168.1.240:52774 A
Ether / IP / TCP 54.70.3.142:https > 192.168.1.240:52774 A / Raw
Ether / IP / TCP 54.70.3.142:https > 192.168.1.240:52774 A / Raw
Ether / IP / TCP 54.70.3.142:https > 192.168.1.240:52774 A / Raw
Ether / IP / TCP 192.168.1.240:52774 > 54.70.3.142:https A
Ether / IP / TCP 54.70.3.142:https > 192.168.1.240:52774 PA / Raw
Ether / IP / TCP 192.168.1.240:52774 > 54.70.3.142:https A
Ether / IP / TCP 192.168.1.240:52774 > 54.70.3.142:https PA / Raw
Ether / IP / TCP 192.168.1.240:52151 > 192.168.1.131:8009 PA / Raw
Ether / IP / TCP 192.168.1.131:8009 > 192.168.1.240:52151 PA / Raw
Ether / IP / TCP 192.168.1.240:52151 > 192.168.1.131:8009 A
Ether / IP / TCP 54.70.3.142:https > 192.168.1.240:52774 A
Ether / IP / TCP 54.70.3.142:https > 192.168.1.240:52774 PA / Raw
Ether / IP / TCP 54.70.3.142:https > 192.168.1.240:52774 PA / Raw
Ether / IP / TCP 192.168.1.240:52774 > 54.70.3.142:https A
d0:fc:d0:3c:dd:c8 > ff:ff:ff:ff:ff:ff (0x7373) / Raw
Ether / IP / TCP 192.168.1.240:52774 > 54.70.3.142:https PA / Raw
Ether / IP / TCP 192.168.1.240:52774 > 54.70.3.142:https PA / Raw
Ether / IP / TCP 192.168.1.240:52774 > 54.70.3.142:https PA / Raw
Ether / IP / TCP 192.168.1.240:52774 > 54.70.3.142:https PA / Raw
Ether / IP / TCP 192.168.1.240:52774 > 54.70.3.142:https PA / Raw
d0:fc:d0:3c:dd:c8 > ff:ff:ff:ff:ff:ff (0x7373) / Raw
Ether / IP / UDP 192.168.1.181:63627 > 239.255.255.250:ssdp / Raw
Ether / IP / UDP 192.168.1.186:61734 > 255.255.255.255:6667 / Raw
Ether / IP / TCP 192.168.1.240:52182 > 149.154.174.100:https PA / Raw
Ether / IP / TCP 149.154.174.100:https > 192.168.1.240:52182 PA / Raw
Ether / IP / TCP 192.168.1.240:52182 > 149.154.174.100:https A
d0:fc:d0:3c:dd:c8 > ff:ff:ff:ff:ff:ff (0x7373) / Raw
Ether / IP / TCP 192.168.1.240:52151 > 192.168.1.131:8009 PA / Raw
Ether / IP / TCP 192.168.1.131:8009 > 192.168.1.240:52151 PA / Raw
Ether / IP / TCP 192.168.1.240:52151 > 192.168.1.131:8009 A
Ether / IP / UDP 192.168.1.128:56047 > 192.168.1.255:59870 / Raw
Ether / IP / UDP 192.168.1.240:55657 > 192.168.1.255:59870 / Raw
Ether / IP / TCP 192.168.1.240:52106 > 192.168.1.139:8009 PA / Raw
Ether / IP / TCP 192.168.1.139:8009 > 192.168.1.240:52106 A
Ether / IP / TCP 192.168.1.139:8009 > 192.168.1.240:52106 PA / Raw
Ether / IP / UDP 192.168.1.240:55658 > 192.168.1.255:59870 / Raw
Ether / IP / UDP 192.168.1.240:55659 > 192.168.1.255:59870 / Raw
Ether / IP / TCP 192.168.1.240:51338 > 54.204.186.125:https PA / Raw
Ether / IP / TCP 192.168.1.240:52106 > 192.168.1.139:8009 A
Ether / IP / TCP 54.204.186.125:https > 192.168.1.240:51338 A / Padding
Ether / IP / TCP 54.204.186.125:https > 192.168.1.240:51338 PA / Raw
Ether / IP / UDP 192.168.1.240:55660 > 192.168.1.255:59870 / Raw
Ether / IP / UDP 192.168.1.240:55661 > 192.168.1.255:59870 / Raw
Ether / IP / TCP 192.168.1.240:51851 > 54.162.183.156:https PA / Raw
Ether / IP / TCP 54.162.183.156:https > 192.168.1.240:51851 PA / Raw
Ether / IP / TCP 192.168.1.240:51338 > 54.204.186.125:https A
Ether / IP / TCP 192.168.1.240:51851 > 54.162.183.156:https A
d0:fc:d0:3c:dd:c8 > ff:ff:ff:ff:ff:ff (0x7373) / Raw
Ether / IP / TCP 192.168.1.240:51928 > 108.156.83.11:https A / Raw
Ether / IP / TCP 108.156.83.11:https > 192.168.1.240:51928 A
Ether / IP / UDP / DNS Qry "b'_googlezone._tcp.local.'" 
Ether / IP / TCP 192.168.1.240:52182 > 149.154.174.100:https PA / Raw
Ether / IP / TCP 149.154.174.100:https > 192.168.1.240:52182 PA / Raw
Ether / IP / TCP 192.168.1.240:52182 > 149.154.174.100:https A
Ether / IP / UDP / DNS Ans "b'0456a6cc-afd1-3e5f-9bab-369e433d587f._googlezone._tcp.local.'" 
Ether / IP / UDP / DNS Ans 
Ether / IP / UDP / DNS Ans "b'0456a6cc-afd1-3e5f-9bab-369e433d587f._googlezone._tcp.local.'" 
Ether / IP / UDP / DNS Ans 
Ether / IP / TCP 192.168.1.240:51810 > 142.250.115.188:5228 A / Raw
Ether / IP / TCP 142.250.115.188:5228 > 192.168.1.240:51810 A
d0:fc:d0:3c:dd:c8 > ff:ff:ff:ff:ff:ff (0x7373) / Raw
Ether / IP / UDP 192.168.1.128:56049 > 239.255.255.250:ssdp / Raw
Ether / IP / TCP 13.248.151.210:https > 192.168.1.240:51930 PA / Raw
Ether / IP / TCP 192.168.1.240:51930 > 13.248.151.210:https A
Ether / IP / UDP / DNS Qry "b'_googlezone._tcp.local.'" 
Ether / IP / UDP / DNS Ans "b'0456a6cc-afd1-3e5f-9bab-369e433d587f._googlezone._tcp.local.'" 
Ether / IP / UDP / DNS Ans "b'4e9e04a6-3736-19fd-8419-8aa208fb16af._googlezone._tcp.local.'" 
Ether / IP / TCP 192.168.1.240:52758 > 207.182.151.82:http A / Raw
Ether / IP / UDP 192.168.1.240:59898 > 142.250.217.227:https / Raw
Ether / IP / UDP 192.168.1.240:59898 > 142.250.217.227:https / Raw
Ether / IP / TCP 140.82.113.25:https > 192.168.1.240:52662 A
Ether / IP / TCP 192.168.1.240:52182 > 149.154.174.100:https A
d0:fc:d0:3c:dd:c8 > ff:ff:ff:ff:ff:ff (0x7373) / Raw
Ether / IP / TCP 192.168.1.240:52790 > 142.250.113.100:https A / Raw
Ether / IP / TCP 142.250.113.100:https > 192.168.1.240:52790 A
Ether / IP / TCP 192.168.1.240:52151 > 192.168.1.131:8009 PA / Raw
Ether / IP / TCP 192.168.1.131:8009 > 192.168.1.240:52151 PA / Raw
Ether / IP / TCP 192.168.1.240:52151 > 192.168.1.131:8009 A
Ether / IP / UDP 192.168.1.240:55640 > 239.255.255.250:ssdp / Raw
Ether / IP / TCP 192.168.1.240:52106 > 192.168.1.139:8009 PA / Raw
Ether / IP / TCP 192.168.1.139:8009 > 192.168.1.240:52106 A
Ether / IP / TCP 192.168.1.139:8009 > 192.168.1.240:52106 PA / Raw
Ether / IP / TCP 192.168.1.240:52106 > 192.168.1.139:8009 A
Ether / IP / TCP 54.162.183.156:https > 192.168.1.240:51851 PA / Raw
Ether / IP / UDP 192.168.1.240:55642 > 192.168.1.128:59871 / Raw
Ether / IP / UDP 192.168.1.240:55644 > 192.168.1.128:59871 / Raw
Ether / IP / UDP 192.168.1.240:55645 > 192.168.1.255:59870 / Raw
Ether / IP / UDP 192.168.1.240:55647 > 192.168.1.255:59870 / Raw
Ether / IP / UDP 192.168.1.240:55648 > 192.168.1.128:59871 / Raw
Ether / IP / UDP 192.168.1.240:55650 > 192.168.1.128:59871 / Raw
Ether / IP / TCP 192.168.1.240:51851 > 54.162.183.156:https A
Ether / IP / TCP 192.168.1.240:52791 > 142.250.113.100:https A / Raw
Ether / IP / TCP 142.250.113.100:https > 192.168.1.240:52791 A
Ether / IP / TCP 192.178.50.74:https > 192.168.1.240:52749 PA / Raw
Ether / IP / TCP 192.178.50.74:https > 192.168.1.240:52749 PA / Raw
Ether / IP / TCP 192.178.50.74:https > 192.168.1.240:52749 PA / Raw
Ether / IP / TCP 192.168.1.240:52749 > 192.178.50.74:https A
Ether / IP / TCP 192.168.1.240:52749 > 192.178.50.74:https PA / Raw
Ether / IP / TCP 192.168.1.240:52182 > 149.154.174.100:https PA / Raw
Ether / IP / TCP 149.154.174.100:https > 192.168.1.240:52182 PA / Raw
Ether / IP / TCP 192.168.1.240:52182 > 149.154.174.100:https A
Ether / IP / UDP 192.168.1.240:64837 > 142.250.217.238:https / Raw
Ether / IP / UDP 142.250.217.238:https > 192.168.1.240:64837 / Raw
Ether / IP / UDP 192.168.1.240:64837 > 142.250.217.238:https / Raw
Ether / IP / UDP 192.168.1.128:63091 > 239.255.255.250:ssdp / Raw
Ether / IP / UDP 142.250.217.238:https > 192.168.1.240:64837 / Raw
Ether / IP / UDP 142.250.217.238:https > 192.168.1.240:64837 / Raw
Ether / IP / UDP 142.250.217.238:https > 192.168.1.240:64837 / Raw
Ether / IP / TCP 192.168.1.240:51930 > 13.248.151.210:https A
Ether / IP / TCP 192.168.1.240:51810 > 142.250.115.188:5228 A / Raw
Ether / IP / TCP 142.250.115.188:5228 > 192.168.1.240:51810 A
d0:fc:d0:3c:dd:c8 > ff:ff:ff:ff:ff:ff (0x7373) / Raw
Ether / IP / TCP 192.168.1.240:52151 > 192.168.1.131:8009 PA / Raw
Ether / IP / TCP 192.168.1.131:8009 > 192.168.1.240:52151 PA / Raw
Ether / IP / UDP 192.168.1.240:57724 > 142.250.217.173:https / Raw
Ether / IP / UDP 192.168.1.240:57724 > 142.250.217.173:https / Raw
Ether / IP / TCP 192.168.1.240:52106 > 192.168.1.139:8009 PA / Raw
Ether / IP / TCP 192.168.1.139:8009 > 192.168.1.240:52106 A
Ether / IP / TCP 192.168.1.139:8009 > 192.168.1.240:52106 PA / Raw
Ether / IP / TCP 192.168.1.240:52961 > 34.234.29.33:https A / Raw
Ether / IP / TCP 34.234.29.33:https > 192.168.1.240:52961 A
Ether / IP / TCP 104.18.36.252:https > 192.168.1.240:52736 PA / Raw
Ether / IP / TCP 104.18.36.252:https > 192.168.1.240:52736 PA / Raw
Ether / IP / TCP 104.18.36.252:https > 192.168.1.240:52736 PA / Raw
Ether / IP / TCP 104.18.36.252:https > 192.168.1.240:52736 PA / Raw
Ether / IP / TCP 192.168.1.240:52736 > 104.18.36.252:https A
Ether / IP / TCP 192.168.1.240:52736 > 104.18.36.252:https PA / Raw
Ether / IP / TCP 104.18.36.252:https > 192.168.1.240:52736 A / Padding
Ether / IP / UDP 192.168.1.240:61386 > 142.250.217.195:https / Raw
Ether / IP / UDP 192.168.1.240:61386 > 142.250.217.195:https / Raw
Ether / IP / UDP 192.168.1.240:61386 > 142.250.217.195:https / Raw
Ether / IP / UDP / DNS Ans "142.250.64.170" 
Ether / IP / UDP 192.168.1.240:52300 > 142.250.64.170:https / Raw
Ether / IP / UDP 192.168.1.240:52300 > 142.250.64.170:https / Raw
Ether / IP / UDP 192.168.1.240:52300 > 142.250.64.170:https / Raw
Ether / IP / UDP 142.250.115.95:https > 192.168.1.240:52097 / Raw
Ether / IP / TCP 192.168.1.240:53042 > 172.64.151.4:https PA / Raw
Ether / IP / TCP 192.168.1.240:53042 > 172.64.151.4:https PA / Raw
Ether / IP / UDP 142.250.64.170:https > 192.168.1.240:52300 / Raw
Ether / IP / UDP 142.250.64.170:https > 192.168.1.240:52300 / Raw
Ether / IP / UDP 142.250.64.170:https > 192.168.1.240:52300 / Raw
Ether / IP / UDP 142.250.64.170:https > 192.168.1.240:52300 / Raw
Ether / IP / UDP 142.250.64.170:https > 192.168.1.240:52300 / Raw
Ether / IP / TCP 172.64.151.4:https > 192.168.1.240:53042 A / Padding
Ether / IP / TCP 172.64.151.4:https > 192.168.1.240:53042 A / Padding
Ether / IP / TCP 172.64.151.4:https > 192.168.1.240:53042 A / Padding
Ether / IP / UDP 192.168.1.240:52300 > 142.250.64.170:https / Raw
Ether / IP / UDP 192.168.1.240:52300 > 142.250.64.170:https / Raw
Ether / IP / UDP 192.168.1.240:52300 > 142.250.64.170:https / Raw
Ether / IP / TCP 172.64.151.4:https > 192.168.1.240:53042 A / Padding
Ether / IP / TCP 172.64.151.4:https > 192.168.1.240:53042 A / Padding
Ether / IP / UDP 142.250.64.170:https > 192.168.1.240:52300 / Raw
Ether / IP / UDP 192.168.1.240:52097 > 142.250.115.95:https / Raw
Ether / IP / UDP 142.250.115.95:https > 192.168.1.240:52097 / Raw
Ether / IP / UDP 142.250.115.95:https > 192.168.1.240:52097 / Raw
Ether / IP / UDP 192.168.1.240:52097 > 142.250.115.95:https / Raw
Ether / IP / UDP 192.168.1.240:49301 > 142.250.189.138:https / Raw
Ether / IP / UDP 142.250.64.170:https > 192.168.1.240:52300 / Raw
Ether / IP / UDP 192.168.1.240:52300 > 142.250.64.170:https / Raw
Ether / IP / UDP 142.250.64.170:https > 192.168.1.240:52300 / Raw
Ether / IP / UDP 142.250.189.138:https > 192.168.1.240:49301 / Raw
Ether / IP / UDP 142.250.64.170:https > 192.168.1.240:52300 / Raw
Ether / IP / UDP 192.168.1.240:49301 > 142.250.189.138:https / Raw
Ether / IP / UDP 192.168.1.240:52097 > 142.250.115.95:https / Raw
Ether / IP / UDP 142.250.189.138:https > 192.168.1.240:49301 / Raw
Ether / IP / UDP 192.168.1.240:49301 > 142.250.189.138:https / Raw
Ether / IP / UDP 192.168.1.240:52300 > 142.250.64.170:https / Raw
Ether / IP / UDP 142.250.189.138:https > 192.168.1.240:49301 / Raw
Ether / IP / UDP 142.250.115.95:https > 192.168.1.240:52097 / Raw
Ether / IP / TCP 172.64.151.4:https > 192.168.1.240:53042 PA / Raw
Ether / IP / TCP 172.64.151.4:https > 192.168.1.240:53042 PA / Raw
Ether / IP / TCP 172.64.151.4:https > 192.168.1.240:53042 PA / Raw
Ether / IP / TCP 192.168.1.240:53042 > 172.64.151.4:https A
Ether / IP / TCP 192.168.1.240:53042 > 172.64.151.4:https PA / Raw
Ether / IP / TCP 172.64.151.4:https > 192.168.1.240:53042 A / Padding
Ether / IP / TCP 192.168.1.240:53042 > 172.64.151.4:https PA / Raw
Ether / IP / TCP 192.168.1.240:53042 > 172.64.151.4:https PA / Raw
Ether / IP / TCP 172.64.151.4:https > 192.168.1.240:53042 A / Padding
Ether / IP / TCP 172.64.151.4:https > 192.168.1.240:53042 A / Padding
Ether / IP / TCP 172.64.151.4:https > 192.168.1.240:53042 A / Padding
Ether / IP / TCP 172.64.151.4:https > 192.168.1.240:53042 A / Padding
Ether / IP / TCP 104.18.7.192:https > 192.168.1.240:53071 PA / Raw
Ether / IP / TCP 192.168.1.240:53071 > 104.18.7.192:https A
Ether / IP / UDP 192.168.1.131:9999 > 255.255.255.255:9999 / Raw
Ether / IP / UDP 192.168.1.180:59398 > 255.255.255.255:6667 / Raw
Ether / ARP who has 192.168.1.138 says 192.168.1.254 / Padding
Ether / ARP who has 192.168.1.250 says 192.168.1.254 / Padding
Ether / ARP who has 192.168.1.131 says 192.168.1.217 / Padding
Ether / ARP who has 192.168.1.131 says 192.168.1.200 / Padding
Ether / ARP who has 192.168.1.131 says 192.168.1.195 / Padding
Ether / ARP who has 192.168.1.131 says 192.168.1.254 / Padding
Ether / ARP who has 192.168.1.186 says 192.168.1.254 / Padding
d0:fc:d0:3c:dd:c8 > ff:ff:ff:ff:ff:ff (0x7373) / Raw
Ether / ARP who has 192.168.1.198 says 192.168.1.254 / Padding
Ether / ARP who has 192.168.1.212 says 192.168.1.254 / Padding
Ether / ARP who has 192.168.1.193 says 192.168.1.254 / Padding
Ether / IP / TCP 192.168.1.240:52182 > 149.154.174.100:https PA / Raw
Ether / IP / TCP 149.154.174.100:https > 192.168.1.240:52182 PA / Raw
Ether / IP / TCP 192.168.1.240:52182 > 149.154.174.100:https A
Ether / ARP who has 192.168.1.195 says 192.168.1.254 / Padding
Ether / ARP who has 192.168.1.200 says 192.168.1.254 / Padding
Ether / IP / UDP 192.168.1.128:63537 > 192.168.1.255:59870 / Raw
Ether / ARP who has 192.168.1.217 says 192.168.1.254 / Padding
Ether / IP / UDP / DNS Qry "b'_companion-link._tcp.local.'" 
Ether / ARP who has 192.168.1.205 says 192.168.1.254 / Padding
Ether / IP / UDP 192.168.1.240:59838 > 192.168.1.255:59870 / Raw
Ether / ARP who has 192.168.1.199 says 192.168.1.254 / Padding
Ether / ARP who has 192.168.1.145 says 192.168.1.254 / Padding
Ether / ARP who has 192.168.1.68 says 192.168.1.254 / Padding
Ether / ARP who has 192.168.1.209 says 192.168.1.254 / Padding
Ether / ARP who has 192.168.1.181 says 192.168.1.254 / Padding
Ether / ARP who has 192.168.1.185 says 192.168.1.254 / Padding
Ether / ARP who has 192.168.1.240 says 192.168.1.254 / Padding
Ether / ARP who has 192.168.1.128 says 192.168.1.254 / Padding
d0:fc:d0:3c:dd:c8 > ff:ff:ff:ff:ff:ff (0x7373) / Raw
Ether / ARP is at f4:a4:75:aa:45:ab says 192.168.1.240
Ether / IP / UDP 192.168.1.240:53254 > 192.178.50.46:https / Raw
Ether / IP / UDP 192.178.50.46:https > 192.168.1.240:53254 / Raw
Ether / IP / UDP 192.168.1.240:53254 > 192.178.50.46:https / Raw
Ether / IP / UDP 192.178.50.46:https > 192.168.1.240:53254 / Raw
Ether / IP / UDP 192.168.1.240:53254 > 192.178.50.46:https / Raw
Ether / IP / UDP 192.178.50.46:https > 192.168.1.240:53254 / Raw
Ether / IP / UDP 192.168.1.240:53254 > 192.178.50.46:https / Raw
Ether / IP / UDP 192.178.50.46:https > 192.168.1.240:53254 / Raw
Ether / IP / TCP 192.178.50.74:https > 192.168.1.240:52749 PA / Raw
Ether / IP / TCP 192.168.1.240:52749 > 192.178.50.74:https A
Ether / IP / TCP 192.168.1.240:52106 > 192.168.1.139:8009 PA / Raw
Ether / IP / TCP 192.168.1.139:8009 > 192.168.1.240:52106 A
Ether / IP / TCP 192.168.1.139:8009 > 192.168.1.240:52106 PA / Raw
Ether / IP / TCP 192.168.1.240:52106 > 192.168.1.139:8009 A
Ether / IP / UDP 192.168.1.240:59474 > 192.168.1.255:59870 / Raw
Ether / IP / TCP 23.209.188.136:https > 192.168.1.240:53087 PA / Raw
Ether / IP / TCP 192.168.1.240:53087 > 23.209.188.136:https RA
Ether / IP / TCP 23.209.188.136:https > 192.168.1.240:53087 FA
Ether / IP / TCP 192.168.1.240:53087 > 23.209.188.136:https R
Ether / IP / UDP 192.168.1.240:57108 > 239.255.255.250:ssdp / Raw
Ether / IP / TCP 192.168.1.240:52213 > 157.240.14.52:https PA / Raw
Ether / IP / TCP 157.240.14.52:https > 192.168.1.240:52213 A / Padding
Ether / IP / TCP 157.240.14.52:https > 192.168.1.240:52213 PA / Raw
Ether / IP / TCP 192.168.1.240:52213 > 157.240.14.52:https A
Ether / IP / TCP 192.168.1.240:52151 > 192.168.1.131:8009 PA / Raw
Ether / IP / TCP 192.168.1.131:8009 > 192.168.1.240:52151 PA / Raw
Ether / IP / TCP 146.75.125.91:https > 192.168.1.240:52998 PA / Raw
d0:fc:d0:3c:dd:c8 > ff:ff:ff:ff:ff:ff (0x7373) / Raw
Ether / IP / TCP 192.168.1.240:52151 > 192.168.1.131:8009 A
